[
  {
    "gate_id": "COM-001",
    "decision": "open",
    "owner_name": "REQUIRED",
    "owner_role": "Commercial/Sales + Finance/Billing",
    "evidence_path": null,
    "evidence_sha256": null,
    "candidate_digest": null,
    "effective_version": null,
    "recorded_at_utc": null,
    "reviewer_name": "REQUIRED",
    "reviewer_role": "REQUIRED",
    "scope": "Registry hard gate COM-001 (commercial): SKU, price, metering, currency/tax, deployment, region, retention, SLA, support, licence rights, renewal, cancellation and offboarding fixed for one Release Candidate. No approved manifest is held, so this receipt records the gate and its inputs only.",
    "limitations": [
      "No approved Commercial Release Manifest exists for a Release Candidate; the registry still records releaseCandidate null.",
      "The only manifest artefact in the repository is docs/production-readiness/commercial-release-manifest-template.md and it is marked DRAFT / NOT APPROVED with price, support, residency and offboarding rows explicitly not held.",
      "Nothing in this receipt approves a price, a tax treatment or a contract term."
    ],
    "external_inputs": [
      "named Commercial/Sales approver",
      "named Finance/Billing approver",
      "approved Commercial Release Manifest bound to one Release Candidate",
      "sample signed quote and order",
      "quote-to-offboarding rehearsal record with timestamps",
      "signed-manifest verification output"
    ]
  },
  {
    "gate_id": "COM-002",
    "decision": "open",
    "owner_name": "REQUIRED",
    "owner_role": "Legal + Engineering",
    "evidence_path": null,
    "evidence_sha256": null,
    "candidate_digest": null,
    "effective_version": null,
    "recorded_at_utc": null,
    "reviewer_name": "REQUIRED",
    "reviewer_role": "REQUIRED",
    "scope": "Registry hard gate COM-002 (licensing-ip): licences, notices, attribution, third-party source provenance, chain-of-title and every shipped package license field complete and counsel-approved, with a non-empty LICENSE reconciling with NOTICE and package metadata. Repository licence inventory is not counsel approval.",
    "limitations": [
      "The presence of LICENSE, NOTICE and THIRD_PARTY_NOTICES in the repository is inventory evidence only and is not a legal conclusion.",
      "Chain-of-title, contributor and vendor provenance records are not held.",
      "A completed exception register with recorded expiry dates is not held; the repository template remains open with expiry unknown.",
      "docs/production-readiness/privacy-legal-review-template.md records counsel approval as not held."
    ],
    "external_inputs": [
      "named Legal counsel approver",
      "signed counsel approval bound to one Release Candidate",
      "chain-of-title and contributor/source provenance records",
      "lockfile-derived SBOM and third-party notice archive for the shipped packages",
      "exception register entries with expiry dates"
    ]
  },
  {
    "gate_id": "COM-003",
    "decision": "open",
    "owner_name": "REQUIRED",
    "owner_role": "Privacy/DPO + Legal + Security",
    "evidence_path": null,
    "evidence_sha256": null,
    "candidate_digest": null,
    "effective_version": null,
    "recorded_at_utc": null,
    "reviewer_name": "REQUIRED",
    "reviewer_role": "REQUIRED",
    "scope": "Registry hard gate COM-003 (privacy): actual telemetry, browser tracing, managed events, AIG payloads, retention, deletion, region, subprocessors and transfer mechanisms matching customer-facing notices and DPA/TOM/SCC terms. No field-level measurement or approval is held.",
    "limitations": [
      "No field-level data-flow matrix has been measured against a deployed build.",
      "No DPA, TOM or SCC approval is held.",
      "docs/production-readiness/data-flow-privacy-v6.md and the privacy/legal template remain unapproved drafts.",
      "Privacy claims in the registry remain blocked until this gate closes."
    ],
    "external_inputs": [
      "named Privacy/DPO approver",
      "field-level data-flow matrix measured from the deployed build",
      "payload assertion report from an instrumented environment",
      "DPA/TOM/SCC approval from named Legal counsel",
      "subprocessor and region list",
      "deletion and export receipts from a real tenant"
    ]
  },
  {
    "gate_id": "COM-004",
    "decision": "open",
    "owner_name": "REQUIRED",
    "owner_role": "Finance/Billing + Product",
    "evidence_path": null,
    "evidence_sha256": null,
    "candidate_digest": null,
    "effective_version": null,
    "recorded_at_utc": null,
    "reviewer_name": "REQUIRED",
    "reviewer_role": "REQUIRED",
    "scope": "Registry hard gate COM-004 (billing-entitlements): price and entitlements enforced by one provider-of-record surviving order, seat change, invoice/reconciliation, cancellation, revocation, export and deletion. No provider decision, invoice or revocation receipt is held.",
    "limitations": [
      "No provider-of-record decision is held; the dashboard defaults to invoice requests without granting entitlement.",
      "No real invoice, reconciliation or dunning record exists.",
      "No revocation or deletion receipt from a billing provider exists.",
      "Self-service checkout is deliberately disabled and is not evidence for this gate."
    ],
    "external_inputs": [
      "named Finance/Billing approver",
      "provider-of-record decision",
      "real invoice and reconciliation example",
      "SKU and seat-change entitlement test run against the provider",
      "revocation and deletion receipts from the provider"
    ]
  },
  {
    "gate_id": "COM-005",
    "decision": "open",
    "owner_name": "REQUIRED",
    "owner_role": "Support/Customer Success + Operations",
    "evidence_path": null,
    "evidence_sha256": null,
    "candidate_digest": null,
    "effective_version": null,
    "recorded_at_utc": null,
    "reviewer_name": "REQUIRED",
    "reviewer_role": "REQUIRED",
    "scope": "Registry hard gate COM-005 (support-operations): customer-visible support, status, security contact, privacy/terms, escalation, severity SLA, diagnostic-consent and reachable ticket paths operating for the sold scope. No operated support surface is claimed.",
    "limitations": [
      "No published support schedule, severity matrix or status page is operated as evidence.",
      "No ticket drill has been executed, so there are no timestamps to record.",
      "No on-call rota or escalation record exists.",
      "docs/production-readiness/support-sla-template.md records every support row as not held."
    ],
    "external_inputs": [
      "named Support/Customer Success owner",
      "published support schedule and severity SLA",
      "timestamped ticket drill in the operated ticket system",
      "reachable status, security and privacy URLs on the deployed domain",
      "on-call escalation record naming real operators"
    ]
  },
  {
    "gate_id": "COM-010",
    "decision": "open",
    "owner_name": "REQUIRED",
    "owner_role": "Product + QA + Engineering + Support",
    "evidence_path": null,
    "evidence_sha256": null,
    "candidate_digest": null,
    "effective_version": null,
    "recorded_at_utc": null,
    "reviewer_name": "REQUIRED",
    "reviewer_role": "REQUIRED",
    "scope": "Registry hard gate COM-010 (ga-connectors): Claude Code, Cursor, VS Code, OpenClaw and OpenCode each have a supported-host matrix, signed artifact, private-registry install path, real-host E2E, rollback, support owner and limitations. No real-host acceptance or signed artifact is held.",
    "limitations": [
      "No real-host side-effect acceptance exists for the advertised connectors.",
      "No official code-signing certificate, notarization or publisher identity is held.",
      "No authenticated private-registry install has been performed.",
      "Local unit and packaged-consumer tests are engineering evidence and are not real-host acceptance."
    ],
    "external_inputs": [
      "named support owner per advertised connector",
      "real-host E2E reports for Claude Code, Cursor, VS Code, OpenClaw and OpenCode",
      "official code-signing certificate or notarization credentials",
      "authenticated private-registry install logs",
      "rollback and disable drill records"
    ]
  },
  {
    "gate_id": "COM-011",
    "decision": "open",
    "owner_name": "REQUIRED",
    "owner_role": "Operations + Privacy/DPO + Legal",
    "evidence_path": null,
    "evidence_sha256": null,
    "candidate_digest": null,
    "effective_version": null,
    "recorded_at_utc": null,
    "reviewer_name": "REQUIRED",
    "reviewer_role": "REQUIRED",
    "scope": "Registry hard gate COM-011 (regions-data-residency): hybrid deployment supporting EU, US and APAC tenant placement with an approved routing, residency, retention, subprocessor, transfer, backup and deletion model. The region list is locked intent, not a working regional service.",
    "limitations": [
      "The EU/US/APAC entries in the registry are product intent and do not prove an operated regional service.",
      "No tenant placement or cross-region negative test has been run against real regional deployments.",
      "No regional DPA/SCC/TOM approval is held.",
      "No regional backup or deletion receipt exists."
    ],
    "external_inputs": [
      "named Operations owner per region",
      "signed cloud provider and data-residency contracts for EU, US and APAC",
      "tenant placement and cross-region negative test results from real regional deployments",
      "DPA/SCC/TOM approval per region",
      "regional backup and deletion receipts"
    ]
  },
  {
    "gate_id": "COM-012",
    "decision": "open",
    "owner_name": "REQUIRED",
    "owner_role": "Finance/Billing + Release Engineering + Support",
    "evidence_path": null,
    "evidence_sha256": null,
    "candidate_digest": null,
    "effective_version": null,
    "recorded_at_utc": null,